<?xml version="1.0" encoding="UTF-8" ?>
<users  xmlns:xsi="http://www.w3.org/2001/XMLSchema-instance"
        xmlns="http://jd02.akhmelev.by.it/somestring+att"
        xsi:schemaLocation="http://jd02.akhmelev.by.it/somestring+att users+att.xsd"
>
    <user nickname="Vasissualy">
        <login>vasyaP</login>
        <email>vasyap@mail.ru</email>
        <password>qwerty</password>
        <ads maxcount="100">
            <ad>
                <description>
                    Good Appartments
                </description>
                <address>
                    Minsk Lenina 12 app. 25
                </address>
                <floor>2</floor>
                <floors>6</floors>
                <rooms>3</rooms>
                <price currency="б.р.">199999.0</price>
                <area>59.9</area>
            </ad>
            <ad>
                <description>
                    Small House
                </description>
                <address>
                    Minsk Khalturina 15
                </address>
                <floor>1</floor>
                <floors>2</floors>
                <rooms>4</rooms>
                <price currency="p.">8888888.0</price>
                <area>66.6</area>
            </ad>
        </ads>
    </user>
    <user  nickname="Petrusik">
        <login>petyaB</login>
        <email>petyab@mail.ru</email>
        <password>asdfgh</password>
        <ads maxcount="100">
            <ad>
                <description>
                    New Appartments
                </description>
                <address>
                    Minsk Scryganava 3 app. 125
                </address>
                <floor>7</floor>
                <floors>25</floors>
                <rooms>2</rooms>
                <price currency="$">120000.0</price>
                <area>60</area>
            </ad>
        </ads>
    </user>
</users>